[
  {"id":"lq-obl-001","clientId":"client-001","entityId":"entity-001","name":"Office Rent London","type":"rent","dueDate":"2026-02-01","amount":50000,"currency":"EUR","frequency":"monthly","status":"scheduled","paidDate":null,"sourceType":"billpay","sourceRef":"bp-002","docIds":["doc-lq-003"],"createdAt":"2024-01-01T00:00:00Z","updatedAt":"2026-01-25T00:00:00Z"},
  {"id":"lq-obl-002","clientId":"client-001","entityId":"entity-001","name":"Credit Facility Interest","type":"loan","dueDate":"2026-02-15","amount":35000,"currency":"USD","frequency":"monthly","status":"scheduled","paidDate":null,"sourceType":"loan","sourceRef":"loan-001","docIds":[],"createdAt":"2023-06-01T00:00:00Z","updatedAt":"2026-01-20T00:00:00Z"},
  {"id":"lq-obl-003","clientId":"client-001","entityId":"entity-002","name":"Q4 Tax Payment","type":"tax","dueDate":"2026-02-05","amount":120000,"currency":"EUR","frequency":"one-time","status":"scheduled","paidDate":null,"sourceType":"manual","sourceRef":null,"docIds":["doc-lq-004"],"createdAt":"2026-01-10T00:00:00Z","updatedAt":"2026-01-20T00:00:00Z"},
  {"id":"lq-obl-004","clientId":"client-001","entityId":"entity-001","name":"Insurance Premium Annual","type":"fee","dueDate":"2026-01-25","amount":28000,"currency":"EUR","frequency":"annual","status":"overdue","paidDate":null,"sourceType":"billpay","sourceRef":"bp-004","docIds":[],"createdAt":"2025-12-01T00:00:00Z","updatedAt":"2026-01-26T00:00:00Z"},
  {"id":"lq-obl-005","clientId":"client-002","entityId":"entity-003","name":"Alpha PE Capital Call","type":"other","dueDate":"2026-02-15","amount":250000,"currency":"USD","frequency":"one-time","status":"scheduled","paidDate":null,"sourceType":"pc","sourceRef":"pcall-001","docIds":["doc-pc-001"],"createdAt":"2026-01-10T00:00:00Z","updatedAt":"2026-01-10T00:00:00Z"},
  {"id":"lq-obl-006","clientId":"client-002","entityId":"entity-003","name":"HQ Rent Zurich","type":"rent","dueDate":"2026-02-01","amount":85000,"currency":"CHF","frequency":"monthly","status":"scheduled","paidDate":null,"sourceType":"billpay","sourceRef":"bp-005","docIds":[],"createdAt":"2022-03-01T00:00:00Z","updatedAt":"2026-01-25T00:00:00Z"},
  {"id":"lq-obl-007","clientId":"client-002","entityId":"entity-003","name":"Legal Retainer Q1","type":"fee","dueDate":"2026-01-31","amount":75000,"currency":"EUR","frequency":"quarterly","status":"scheduled","paidDate":null,"sourceType":"billpay","sourceRef":"bp-006","docIds":[],"createdAt":"2025-10-01T00:00:00Z","updatedAt":"2026-01-15T00:00:00Z"},
  {"id":"lq-obl-008","clientId":"client-003","entityId":"entity-004","name":"Vehicle Lease","type":"rent","dueDate":"2026-02-01","amount":4500,"currency":"EUR","frequency":"monthly","status":"scheduled","paidDate":null,"sourceType":"billpay","sourceRef":"bp-007","docIds":[],"createdAt":"2024-06-01T00:00:00Z","updatedAt":"2026-01-25T00:00:00Z"},
  {"id":"lq-obl-009","clientId":"client-003","entityId":"entity-004","name":"Zeta Fund Capital Call","type":"other","dueDate":"2026-01-20","amount":400000,"currency":"USD","frequency":"one-time","status":"overdue","paidDate":null,"sourceType":"pc","sourceRef":"pcall-003","docIds":["doc-pc-002"],"createdAt":"2025-12-15T00:00:00Z","updatedAt":"2026-01-21T00:00:00Z"},
  {"id":"lq-obl-010","clientId":"client-003","entityId":"entity-004","name":"IT Services Monthly","type":"bill","dueDate":"2026-02-05","amount":12000,"currency":"EUR","frequency":"monthly","status":"scheduled","paidDate":null,"sourceType":"billpay","sourceRef":"bp-008","docIds":[],"createdAt":"2024-09-01T00:00:00Z","updatedAt":"2026-01-20T00:00:00Z"},
  {"id":"lq-obl-011","clientId":"client-001","entityId":"entity-001","name":"Staff Salaries Feb","type":"salary","dueDate":"2026-02-28","amount":180000,"currency":"EUR","frequency":"monthly","status":"scheduled","paidDate":null,"sourceType":"manual","sourceRef":null,"docIds":[],"createdAt":"2023-01-01T00:00:00Z","updatedAt":"2026-01-28T00:00:00Z"},
  {"id":"lq-obl-012","clientId":"client-001","entityId":"entity-002","name":"Audit Fees","type":"fee","dueDate":"2026-03-15","amount":95000,"currency":"EUR","frequency":"annual","status":"scheduled","paidDate":null,"sourceType":"billpay","sourceRef":"bp-009","docIds":[],"createdAt":"2025-12-01T00:00:00Z","updatedAt":"2026-01-15T00:00:00Z"},
  {"id":"lq-obl-013","clientId":"client-002","entityId":"entity-003","name":"Property Tax","type":"tax","dueDate":"2026-01-28","amount":65000,"currency":"EUR","frequency":"quarterly","status":"overdue","paidDate":null,"sourceType":"manual","sourceRef":null,"docIds":["doc-lq-005"],"createdAt":"2025-12-15T00:00:00Z","updatedAt":"2026-01-29T00:00:00Z"},
  {"id":"lq-obl-014","clientId":"client-002","entityId":"entity-003","name":"Beta VC Capital Call","type":"other","dueDate":"2026-02-01","amount":150000,"currency":"USD","frequency":"one-time","status":"scheduled","paidDate":null,"sourceType":"pc","sourceRef":"pcall-002","docIds":[],"createdAt":"2026-01-05T00:00:00Z","updatedAt":"2026-01-05T00:00:00Z"},
  {"id":"lq-obl-015","clientId":"client-001","entityId":"entity-001","name":"Credit Facility Principal","type":"loan","dueDate":"2026-03-31","amount":500000,"currency":"USD","frequency":"quarterly","status":"scheduled","paidDate":null,"sourceType":"loan","sourceRef":"loan-001","docIds":["doc-lq-006"],"createdAt":"2023-06-01T00:00:00Z","updatedAt":"2026-01-20T00:00:00Z"}
]
